<?xml version="1.0" encoding="UTF-8" ?>
<xs:schema xmlns:xs="http://www.w3.org/2001/XMLSchema">
    <xs:import namespace="http://www.w3.org/XML/1998/namespace"
               schemaLocation="xml.xsd"/>
    
	<xs:element name="resourcePool">
        <xs:complexType>
            <xs:sequence>
                <xs:element name="resource" type="resourceType" maxOccurs="unbounded"/>
            </xs:sequence>
        </xs:complexType>
    </xs:element>

	<xs:complexType name="resourceType">
		<xs:sequence>
			<!--Personal Background-->
			<xs:element name="photo" type="photoType" minOccurs="0" maxOccurs="unbounded"/>
			<xs:element name="age" type="xs:duration"/>
			<xs:element name="prefix" type="xs:string" minOccurs="0"/>
			<xs:element name="firstName" type="xs:string" maxOccurs="unbounded"/>
			<xs:element name="lastName" type="xs:string" maxOccurs="unbounded"/>
			<xs:element name="maritalStatus" type="textWithLangType"/>
			<xs:element name="child" type="childType" minOccurs="0" maxOccurs="unbounded"/>
			<xs:element name="stressor" type="textWithLangType" minOccurs="0" maxOccurs="unbounded"/>
			<xs:element name="personalInfo" type="textWithLangType" minOccurs="0" maxOccurs="unbounded"/>

			<!--Professional Background-->
			<xs:element name="profession" type="textWithLangType" maxOccurs="unbounded"/>
			<xs:element name="department" type="textWithLangType" maxOccurs="unbounded"/>
			<xs:element name="workExperience" type="xs:duration" minOccurs="0"/>
			<xs:element name="trainingDuration" type="xs:duration" minOccurs="0"/>
			<xs:element name="weeklyHours" type="xs:duration"/>
			<xs:element name="overtime" type="xs:duration"/>
			<xs:element name="yearlyTimeOf" type="xs:duration"/>
			<xs:element name="yearlyEducation" type="xs:duration"/>
			<xs:element name="training" type="textWithLangType" minOccurs="0" maxOccurs="unbounded"/>
			<xs:element name="qualification" type="textWithLangType" minOccurs="0" maxOccurs="unbounded"/>
			<xs:element name="workAgreement" type="workAgreementType" minOccurs="0" maxOccurs="unbounded"/>
			<xs:element name="studies" type ="studieType" minOccurs="0" maxOccurs="unbounded"/>
			<xs:element name="additionalJob" type="additionalJobType" minOccurs="0" maxOccurs="unbounded"/>
			<xs:element name="arrivalTime" type="xs:duration"/>
			<xs:element name="meansOfTransport" type="textWithLangType" minOccurs="0" maxOccurs="unbounded"/>
			<xs:element name="professionalInfo" type="textWithLangType" minOccurs="0" maxOccurs="unbounded"/>
			<!--Skills-->
			<xs:element name="skill" type="textWithLangType" minOccurs="0" maxOccurs="unbounded"/>
			<!--Character Traits-->
			<xs:element name="trait" type="traitType" minOccurs="0" maxOccurs="unbounded"/>
		</xs:sequence>
		<xs:attribute ref="xml:id"/>
	</xs:complexType>
	
	<xs:complexType name="photoType">
		<xs:sequence>
			<xs:element name="URI" type="xs:anyURI"/>
		</xs:sequence>
	</xs:complexType>

	<xs:complexType name="childType">
		<xs:sequence>
			<xs:element name="age" type="xs:duration"/>
		</xs:sequence>
	</xs:complexType>

	<xs:simpleType name="workAgreementType">
		<xs:restriction base="xs:string">
			<xs:pattern value="[0-6]-(0[0-9]|1[0-9]|2[0-3]):[0-5][0-9]-(0[0-9]|1[0-9]|2[0-3]):[0-5][0-9]"/>
		</xs:restriction>
	</xs:simpleType>

	<xs:complexType name ="studieType">
		<xs:sequence>
			<xs:element name="name" type="xs:string"/>
			<xs:element name="location" type="xs:string" minOccurs="0"/>
		</xs:sequence>
		<xs:attribute ref="xml:lang" use="required"/>
	</xs:complexType>

	<xs:complexType name="additionalJobType">
		<xs:sequence>
			<xs:element name="name" type="xs:string"/>
			<xs:element name="yearlyRequiredDays" type="xs:duration" minOccurs="0"/>
		</xs:sequence>
		<xs:attribute ref="xml:lang" use="required"/>
	</xs:complexType>
	
	<xs:complexType name ="traitType">
		<xs:sequence>
			<xs:element name="name" type="xs:string"/>
			<xs:element name="value" type="percentageType"/>
		</xs:sequence>
		<xs:attribute ref="xml:lang" use="required"/>
	</xs:complexType>

	<xs:complexType name="textWithLangType">
		<xs:simpleContent>
			<xs:extension base="xs:string">
				<xs:attribute ref="xml:lang" use="required"/>
			</xs:extension>
		</xs:simpleContent>
	</xs:complexType>

	<xs:simpleType name ="percentageType">
		<xs:restriction base="xs:integer">
			<xs:minInclusive value="0"/>
			<xs:maxInclusive value="100"/>
		</xs:restriction>
	</xs:simpleType>
</xs:schema>